{
  "schema_version": "weave.work_item_proposal.v1",
  "id": "proposal_canary_incident_4012",
  "producer": {
    "name": "bb-triage-workload",
    "version": "0.1.0"
  },
  "produced_at": "2026-07-01T02:14:00Z",
  "correlation_id": "canary:misty-step/bitterblossom:incident:4012:triage",
  "source": {
    "kind": "canary",
    "external_id": "incident-4012",
    "url": "https://canary.example.invalid/incidents/4012"
  },
  "subject": {
    "repo": "misty-step/bitterblossom",
    "kind": "incident",
    "id": "4012"
  },
  "idempotency_key": "canary:incident-4012:proposal:dlq-retry-ergonomics",
  "proposed_card": {
    "title": "DLQ retry ergonomics: exponential backoff with jitter",
    "description_ref": "https://canary.example.invalid/incidents/4012/triage",
    "priority": "P2",
    "labels": ["reliability", "dlq", "incident-4012"]
  },
  "status": "proposed",
  "payload": {
    "incident_severity": "warning",
    "affected_component": "dlq-retry"
  }
}
